'PriemData','pData','Laikas','Pradzia','Pabaiga','Organizacija','avAprasymas','avPranesta','IskvietimoVieta','Darbai','Medziagos','SumaSuPVM'
2018-01-09,'18.01.09','08:35','10:00','10:35','418-oji DNSB','Kyla  nuotekos  virtuvëje. Uþsikimðæs bendras virtuvinis nuotekø stovas',,'Mokyklos 5','1.5. Avarinio ekipaþo atvykimas pagal iðkvietimà. Nuotekø tinklo apþiûra.  Nuotekos tinklø bendro  virtuvinio stovo valymas su elektrine freza   kai vamzdþio skersmuo iki 100 mm., ilgis daugiau kaip 10 m. ið pravalos stove rûsyje. Fekalijø nutekëjimo patikrinimas vandens srove.','',40.329299999999994
2018-01-09,'18.01.09','09:05','10:00','10:40','Nëra sutarties, 0','Kyla nuotekos klozete. Uþsikimðæs bendras  nuotekø vamzdis',,'Sodø 22','1.5. Avarinio ekipaþo atvykimas pagal iðkvietimà. Nuotekø tinklo apþiûra. Bendro nuotekos tinklø  vamzdþio valymas su elektrine freza, kai vamzdþio skersmuo iki 100 mm., ilgis daugiau kaip 10 m. ið pravalos vyrø yualeto patalpos  grindyse.  Fekalijø nutekëjimo patikrinimas vandens srove.','',48.3879
2018-01-09,'18.01.09','09:35','10:50','11:25','Nëra sutarties','Kyla  nuotekos  virtuvëje. Uþsikimðæs  virtuvinis nuotekø vamzdis iki  stovo',,'T. Zano 2a','1.1. Avarinio ekipaþo atvykimas pagal iðkvietimà. Nuotekø tinklo apþiûra. Sifono po plautuve virtuvës patalpoje iðardymas ir iðvalymas.  Nuotekø  tinklø  virtuvinio vamzdþio  valymas su gyvatuku  kai vamzdþio  skersmuo iki 50 mm., ilgis iki  5 m.  Sifono surinkimas ir fekalijø nutekëjimo patikrinimas vandens srove.','',27.2976
2018-01-09,'18.01.09','10:50','11:10','12:40','Nëra sutarties','Nëra apðvietimo laiptinëse',,'Trakø 12','4.3. Avarinio ekipaþo atvykimas pagal iðkvietimà. Elektros instaliacijos apþiûra. Srovës  ir átampos parametrø matavimas atskiruose fazëse bei kontaktø patikrinimas. Gedimo pobûdþio ir vietos nustatymas.  32  A  ir  63  A  automatiniø jungikliø pakeitimas bendrame tinkle namo elektros skydinëje ,  elektros tiekimo atnaujinimas. Ávadinës dëþutës atidarymas ir uþdarymas prisukant já varþtais.','Jungiklis automatinis  1P C 63A 1 vnt; Jungiklis automatinis  1P C 32A 1 vnt',52.5745
2018-01-09,'18.01.09','11:35','11:50','12:10','Nëra sutarties','Kyla nuotekos klozete',,'Laisvës  pr. 125','1.10. Avarinio ekipaþo atvykimas pagal iðkvietimà. Avarinës situacijos patikrinimas ir avarijos pobûdþio nustatymas. Nustatyta, kad atvykimo metu patikrinus nuotekos klozete nuteka normaliai. Dalyvavo atsakingas asmuo.','',18.827600000000003
2018-01-09,'18.01.09','13:00','14:00','15:45','Nëra sutarties','Kyla nuotekos patalpoje',,'Dûmø 3','1.5. Avarinio ekipaþo atvykimas pagal iðkvietimà. Nuotekø tinklo apþiûra. Ávadinio ðulinio dangèio atidarymas. Nuotekos tinklø  valymas elektrine freza, kai vamzdþio skersmuo iki 100 mm., ilgis daugiau kaip 10 m. ið ðulinio iki pastato  .  Ðulinio dangèio uþdarymas. Fekalijø nutekëjimo patikrinimas vandens srove.','',48.3879
2018-01-09,'18.01.09','13:50','14:20','14:50','Nëra sutarties','Kyla nuotekos klozete',,'Naujakiemio 6','1.3. Avarinio ekipaþo atvykimas pagal iðkvietimà. Nuotekø tinklo apþiûra. Ávadinio ðulinio dangèio atidarymas. Nuotekos tinklø  valymas su vamzdþiu, kai  skersmuo iki 100 mm.,  ið ðulinio iki pastato.  Ðulinio dangèio uþdarymas. Fekalijø nutekëjimo patikrinimas vandens srove.','',39.7969
2018-01-09,'18.01.09','14:15','14:45','15:00','519-oji DNSB','Laða vanduo prie gyvatuko bute',,'Darbininkø 19','1.10. Avarinio ekipaþo atvykimas pagal iðkvietimà. Avarinës situacijos patikrinimas ir avarijos pobûdþio nustatymas. Nustatyta, kad atvykimo metu vanduo prie gyvatuko sujungimø jau nebelaðëjo.','',15.6937
2018-01-09,'18.01.09','15:40','15:55','16:30','796-oji DNSB , _','Kyla  nuotekos  virtuvëje. Uþsikimðæs bendras virtuvinis nuotekø stovas',,'Kareiviø 9','1.5. Avarinio ekipaþo atvykimas pagal iðkvietimà. Nuotekø tinklo apþiûra. Sifono po plautuve virtuvës patalpoje iðardymas ir iðvalymas.  Nuotekø  tinklø bendro virtuvinio stovo  valymas su elektrine freza  tarp 2-tro ir 3-èio aukðtø kai vamzdþio  skersmuo iki 50 mm., ilgis daugiau kaip 10 m.  Sifono surinkimas ir fekalijø nutekëjimo patikrinimas vandens srove.','',40.329299999999994
2018-01-09,'18.01.09','17:05','17:30','18:00','UAB "Pastatø meistrai"-( UAB ,,Senam.ûkis") gavus praneðimà -ne vëliai kaip per dvi val. atvykti.Kont. asm.Tomas Kiðunas 862048707, Tomas Pupkus 865597556, Kiek.v. ryta atask.-klauskite@civinity.euinform.gyvent.-tel. 870055188, 17/MA-150','Teka vanduo ið radiatoriaus laiptinëje',,'Sirvydo 5','1.10. Avarinio ekipaþo atvykimas pagal iðkvietimà. Avarinës situacijos patikrinimas ir avarijos pobûdþio nustatymas. Nustatyta, kad  atvykus ðildymas namui buvo jau uþdarytas administruojanèios ámonës darbuotojø. Trûkæs ðpiþinis radiatorius 3-èio aukðto laiptinëje.','',15.6937
2018-01-09,'18.01.09','17:30','18:10','18:40','535-oji DNSB "Saulëtekis", _','Teka vanduo ið virðaus',,'Þirmûnø 54','2.1Avarinio ekipaþo atvykimas pagal iðkvietimà. Situacijos ávertinimas. Raktø prie uþdaromos armatûros priëjimo ir reikiamà stovo pagal komunikacijø iðdëstymà suradimas. Karðto vandens tiekimo iðjungimas stovui uþdarant ventilá. Vandens iðleidimas ið sistemos atidarius nuleidëjà. Tekëjo ið perdenginio, virðutiniame 77-me bute nieks neatidarë durø. Uþpiltos 74-to buto lubos ir sienos, virtuvëje, koridoriuje, tualete bei vonioje.  Informuotas bendrijos santechnikas.','',18.8155
2018-01-09,'18.01.09','18:10','18:20','19:00','UAB "Fabeta " nuo 16 val. 30 min. iki 7 val. 30 min. d.dien.ir visomis nedarbo bei ðvenèiø dienomis.(dël neaiðk. skambinti energetikui - Gintaras Savickas tel. 867472732, 2','Nenuteka nuotekos  rûsyje.  Uþsikimðæs bendras nuotekø  vamzdis  rûsyje',,'Þadeikos 1','1.5. Avarinio ekipaþo atvykimas pagal iðkvietimà. Nuotekø tinklo apþiûra. Bendro nuotekos tinklø  vamzdþio valymas su elektrine freza, kai vamzdþio skersmuo iki 100 mm., ilgis daugiau kaip 10 m. ið pravalos rûsio  grindyse.  Fekalijø nutekëjimo patikrinimas vandens srove.','',40.329299999999994
2018-01-09,'18.01.09','18:30','18:45','19:40','UAB "Pastatø meistrai"-( UAB ,,Senam.ûkis") gavus praneðimà -ne vëliai kaip per dvi val. atvykti.Kont. asm.Tomas Kiðunas 862048707, Tomas Pupkus 865597556, Kiek.v. ryta atask.-klauskite@civinity.euinform.gyvent.-tel. 870055188, 17/MA-150','Neðyla radiatoriai bute',,'Universiteto 2a','1.10. Avarinio ekipaþo atvykimas pagal iðkvietimà. Avarinës situacijos patikrinimas ir avarijos pobûdþio nustatymas. Nustatyta, kad neðildo bute radiatoriai nes nëra elektros rûsyje ir ðil. mazge. Nëra priëjimo prie elektros skydinës kuri randasi uþrakintos vaistinës patalpose. Informuotas administruojamos ámonës atsakingas asmuo.','',18.827600000000003
2018-01-09,'18.01.09','18:30','18:50','19:15','171-oji DNSB "Ðvyturys", _',' Nenuteka nuotekos  rûsyje.  Uþsikimðæs bendras nuotekø  vamzdis  rûsyje',,'Þirmûnø 30','1.5. Avarinio ekipaþo atvykimas pagal iðkvietimà. Nuotekø tinklo apþiûra. Bendro nuotekos tinklø  vamzdþio valymas su elektrine freza, kai vamzdþio skersmuo iki 100 mm., ilgis daugiau kaip 10 m. ið pravalos rûsio  grindyse.  Fekalijø nutekëjimo patikrinimas vandens srove.','',40.329299999999994
2018-01-09,'18.01.09','19:05','19:30','20:20','UAB "Ðilëja " (Tel. 2466644), _','Nëra karðto vandens butuose',,'Ukmergës 186','2.2. Avarinio ekipaþo atvykimas pagal iðkvietimà. Situacijos ávertinimas. Raktø prie uþdaromos armatûros priëjimo ir komunikacijø iðdëstymo suradimas. Karðto vandens tiekimo  ájungimas namui atidarant ventilá ðil. mazge. Karðto vandens atsiradimo butuose patikrinimas.','',21.864699999999997
2018-01-09,'18.01.09','19:50','20:10','20:40','UAB "Adminsta" (Tel. 2788402) .Dadbo dien. nuo 16:30 iki  7:30 val.tel.861279192; Antanas Auglys - 861117193 ) tel. direkt.862827236, _','Nëra karðto vandens butuose',,'Santariðkiø 43b','1.10. Avarinio ekipaþo atvykimas pagal iðkvietimà. Avarinës situacijos patikrinimas ir avarijos pobûdþio nustatymas. Nustatyta, kad negalime patekti á uþrakintà ðil. mazgà, nuvykus á nustatytà raktø buvimo vietà, raktø neaptikome. Informuotas administruojanèios ámonës atsakingas asmuo.','',15.6937
2018-01-09,'18.01.09','20:25','20:30','21:15','225-oji DNSB  "Juna", _','Teka vanduo ið vamzdþio rûsyje',,'Justiniðkiø 82','2.3. Avarinio ekipaþo atvykimas pagal iðkvietimà. Avarinës situacijos ávertinimas. Prarûdijusios arba trukusios vamzdþio vietos suradimas, daþø ir rûdþiø nuvalymas. Guminës tarpinës uþdëjimas. Spaustuvo árengimas ðalto vandens vamzdþiui  iki 50 mm.   uþverþiant  varþtais rûsyje. Taisomos vietos sandarumo patikrinimas.','Sàvarþa 1 vnt',29.7539
2018-01-09,'18.01.09','21:25','21:40','22:10','Nëra sutarties','Kyla nuotekos klozete. Uþsikimðæs bendras  nuotekø vamzdis',,'Ðeðkinës 59a','1.5. Avarinio ekipaþo atvykimas pagal iðkvietimà. Nuotekø tinklo apþiûra. Bendro nuotekos tinklø  vamzdþio valymas su elektrine freza, kai vamzdþio skersmuo iki 100 mm., ilgis daugiau kaip 10 m. ið pravalos tualeto patalpos  grindyse.  Fekalijø nutekëjimo patikrinimas vandens srove.','',48.3879
2018-01-09,'18.01.09','21:55','22:15','23:00','DNSB Keramikø g. 6','Kyla  nuotekos  virtuvëje. Uþsikimðæs bendras virtuvinis nuotekø stovas',,'Keramikø 6','1.5. Avarinio ekipaþo atvykimas pagal iðkvietimà. Nuotekø tinklo apþiûra . Pravalos dangèio nuëmimas atsukant varþtus stovui rûsyje.  Nuotekos tinklø bendro virtuvinio stovo valymas su elektrine freza   kai vamzdþio  skersmuo iki 100 mm., ilgis daugiau kaip 10 m.  Pravalos dangèio uþdëjimas ir fekalijø nutekëjimo patikrinimas vandens srove.','',48.3879
2018-01-09,'18.01.09','22:20','22:35','22:55','895-oji DNSB, _','Teka nuotekos po plautuve',,'Þëruèio 21','1.10. Avarinio ekipaþo atvykimas pagal iðkvietimà. Avarinës situacijos patikrinimas ir avarijos pobûdþio nustatymas. Nustatyta, kad reikalingas trûkusio sifono po plautuve virtuvës patalpoje keitimas.','',15.6937
