2016-05-31,'16.05.31','17:55','18:00','19:20','UAB ,,Yglë pastatø valdymas" kvieèia tik atsak.asm.','Nenuteka nuotekos valgomojo plautuvëje',,'Virðuliðkiø 30-maxima, Atsak. Vladimiras, 861278611','1.2. Avarinio ekipaþo atvykimas pagal iðkvietimà. Nuotekø tinklo apþiûra . Sifono po plautuve 2-tro aukðto valgomojo  patalpoje iðardymas ir iðvalymas. Valant nuotekos tinklø vamzdá   su gyvatuku kai vamzdþio skersmuo iki 50 mm., ilgis daugiau kaip  10  m. pravalyti negalime, nëra priëjimo prie pravalos.  Sifono surinkimas. Dalyvavo atsakingas asmuo.','',32.742599999999994
2016-05-31,'16.05.31','19:55','20:05','21:10','801-oji daugiabuèiø namø savininkø bendrija, _','Kyla nuotekos klozete. Uþsikimðæs bendras  nuotekø vamzdis.',,'Baltruðaièio 3-klinika, Kuprytë, 867456004','1.5. Avarinio ekipaþo atvykimas pagal iðkvietimà. Nuotekø tinklo apþiûra.  Pravalos dangèio nuëmimas  stovui 1-mo aukðto laiptinëje.  Nuotekos tinklø bendro vamzdþio  valymas su elektrine  freza kai vamzdþio skersmuo iki 100 mm., ilgis daugiau kaip 10 m.  Pravalos dangèio uþdëjimas ir fekalijø nutekëjimo patikrinimas vandens srove.','',40.329299999999994
2016-05-31,'16.05.31','22:30','22:45','23:20','UAB "Ðilëja " (Tel. 2466644), _','Laða vanduo tech. spintoje ið virðaus',,'Gelvonø 36-48, Burdaitë, 860291289','1.10. Avarinio ekipaþo atvykimas pagal iðkvietimà. Avarinës situacijos patikrinimas ir avarijos pobûdþio nustatymas. Nustatyta, kad  laða ðaltas vanduo ið perdenginio koridoriaus tech. spintoje. Virðutiniame 60-me bute nëra priëjimo prie vamzdþiø koridoriaus tech.  spintoje. Stovø ventiliai randasi uþrakintame 69-to buto sandeliuke rûsyje, nieks neatidarë buto durø. Nuo ðalto vandens uþdarymo namui gyv. atsisakë.','',18.827600000000003
2016-05-31,'16.05.31','22:40','22:50','23:50','UAB "Verkiø bûstas " (Tel. 2477330; 862020601), _','Kyla  nuotekos  virtuvëje. Uþsikimðæs bendras virtuvinis nuotekø stovas',,'Mokyklos 3-14, Girþienë, 2729795','1.2. Avarinio ekipaþo atvykimas pagal iðkvietimà. Nuotekø tinklo apþiûra. Sifono po plautuve virtuvës patalpoje iðardymas ir iðvalymas.  Nuotekø  tinklø bendro virtuvinio stovo  valymas su gyvatuku tarp 3-èio ir 4-to aukðto kai vamzdþio  skersmuo iki 50 mm., ilgis iki 10 m.  Sifono surinkimas ir fekalijø nutekëjimo patikrinimas vandens srove.','',38.574799999999994
2016-05-31,'16.05.31','23:40','23:50','00:15','360-oji DNSB (darbo dien.visà parà priimti  tik  ið pirmininko Zaleckio ir pavad. Linkevièiaus, ið.ir ðv.dien.ið apt.namø gyv., _','Laða vanduo tech. spintoje ið virðaus','Praneðti 360-oji DNSB','Druskio V. 9-123, Stulgaitë, 862270326','2.1Avarinio ekipaþo atvykimas pagal iðkvietimà. Situacijos ávertinimas. Raktø prie uþdaromos armatûros priëjimo ir reikiamà stovo pagal komunikacijø iðdëstymà suradimas. Karðto vandens tiekimo iðjungimas stovui uþdarant ventilá. Vandens iðleidimas ið sistemos atidarius nuleidëjà. Tekëjo ið perdenginio koridoriaus tech. spintoje. Virðutiniuose 126-me ir 129-me butuose nieks neatidarë durø. (Pirmininkui prisiskambinti negalëjome, atjungtas telefonas)','',22.5786
2016-05-31,'16.05.31','02:50','03:10','03:45','UAB "Fabeta " nuo 16 val. 30 min. iki 7 val. 30 min. d.dien.ir visomis nedarbo bei ðvenèiø dienomis.(dël neaiðk. skambinti energetikui - Edvardas Trinkûnas tel. 867472732, 2','Kyla  nuotekos  virtuvëje. Uþsikimðæs bendras virtuvinis nuotekø stovas',,'Stanevièiaus S. 39-62, Azarenko, 861814483','1.3. Avarinio ekipaþo atvykimas pagal iðkvietimà. Nuotekø tinklo apþiûra . Pravalos dangèio nuëmimas atsukant varþtus stovui rûsyje.  Nuotekos tinklø bendro virtuvinio stovo valymas su gyvatuku   kai vamzdþio  skersmuo iki 50 mm., ilgis daugiau kaip 10 m.  Pravalos dangèio uþdëjimas ir fekalijø nutekëjimo patikrinimas vandens srove.','',39.7969
2016-05-31,'16.05.31','07:00','07:30','08:10','UAB "Ðilëja " (Tel. 2466644), _','Teka vanduo ið virðaus',,'Gelvonø 30-16, Aleksandar, 860089143','1.10. Avarinio ekipaþo atvykimas pagal iðkvietimà. Avarinës situacijos patikrinimas ir avarijos pobûdþio nustatymas. Nustatyta, kad  trûkæs ðalto vandens stovas 20-buto koridoriaus tech spintos grindø perdenginyje, reikalingas minëto stovo keitimas. Uþdarë ðaltà ir karðtà vandená 32-tro namo vandens apskaitos mazge administruojanèios ámonës darbuotojai. Stovui rûsyje ventiliai nelaiko. Uþpiltos 16-to buto parketinës grindys.','',18.827600000000003
2016-05-31,'16.05.31','08:00','08:15','08:40','Nëra sutarties','Nenuteka nuotekos rûsyje.  Uþsikimðæs bendras nuotekø  vamzdis rûsyje',,'Tauragnø 15-n.n., Denisov, 2724616','1.10. Avarinio ekipaþo atvykimas pagal iðkvietimà. Ðulinio dangèio nuëmimas ir uþdëjimas. Avarinës situacijos ávertinimas ir avarijos pobûdþio nustatymas. Nustatyta, kad uþbetonuotas nuotekos tinklø vamzdþio iðëjimas ðulinyje.','',15.6937
2016-05-31,'16.05.31','08:35','08:50','09:30','551-oji DNSB, _','Nenuteka nuotekos klozete. Uþsikimðæs nuotekø vamzdis iki stovo',,'Architektø 105-77, Pirm. Kasiulis, 861630879','1.1. Avarinio ekipaþo atvykimas pagal iðkvietimà. Nuotekø tinklo apþiûra. Nuotekos tinklø  vamzdþio valymas su rankine pompa per klozetà tualeto patalpoje.  Fekalijø nutekëjimo patikrinimas vandens srove.','',27.2976
2016-05-31,'16.05.31','08:55','09:30','11:30','Biudþetinë ástaiga Vilniaus miesto kriziø centras, 773/15','Nenuteka nuotekos duðinëje ir skalbykloje',,'Kojelavièiaus A.V. 129-kriziø centras, Petrauskienë, 868665759','1.4. Avarinio ekipaþo atvykimas pagal iðkvietimà. Nuotekø tinklo apþiûra.  Valant nuotekos tinklø bendrà vamzdþá  su gyvatuku   kai vamzdþio skersmuo iki 50 mm., ilgis iki  10 m. ið pravalos skalbyklos patalpoje  pravalyti negalëjome, gyvatukas remiasi á kietà daiktà (Átarema á atbuliná voþtuvà). Neveikia nuotekos tinklø  atbulinio voþtuvo automatika, reikalingas jo remontas.','',27.2976
2016-05-31,'16.05.31','09:00','09:40','10:45','225-oji DNSB  "Juna", _',' Nenuteka nuotekos rûsyje.  Uþsikimðæs bendras nuotekø  vamzdis rûsyje',,'Taikos 48-rûsyje, Atsak. Duðkevièius, 861252979','1.5. Avarinio ekipaþo atvykimas pagal iðkvietimà. Nuotekø tinklo apþiûra. Bendro nuotekos tinklø  vamzdþio valymas su elektrine freza, kai vamzdþio skersmuo iki 100 mm., ilgis daugiau kaip 10 m. ið pravalos rûsio  grindyse.  Fekalijø nutekëjimo patikrinimas vandens srove. Dalyvavo atsakingas asmuo.','',40.329299999999994
2016-05-31,'16.05.31','10:10','10:50','11:40','121-oji Daugiabuèiø namø savininkø bendrija, _','Nenuteka nuotekos rûsyje.  Uþsikimðæs bendras nuotekø  vamzdis rûsyje',,'Architektø 184-rûsyje, Santech. Kandiþauskas, 860120066','1.5. . Avarinio ekipaþo atvykimas pagal iðkvietimà. Nuotekø tinklo apþiûra. Bendro nuotekos tinklø  vamzdþio valymas su elektrine freza, kai vamzdþio skersmuo iki 100 mm., ilgis daugiau kaip 10 m. ið pravalos rûsio  palubëje.  Fekalijø nutekëjimo patikrinimas vandens srove. Dalyvavo bendrijos santechnikas.','',40.329299999999994
2016-05-31,'16.05.31','11:55','12:30','13:15','UAB ,,GREEN CAFE"','Laða vanduo bare',,'Vilniaus 29-UAB, Jenuðkevièius, 861622766','1.10. Avarinio ekipaþo atvykimas pagal iðkvietimà. Avarinës situacijos patikrinimas ir avarijos pobûdþio nustatymas. Nustatyta, kad laða vanduo per nuotekos tinklø smulkintuvo blogà sandarumà po plautuve baro patalpoje. Nëra priëjimo prie minëto smulkintuvo, reikalingi paruoðimo darbai.','',18.827600000000003
2016-05-31,'16.05.31','13:40','14:00','15:50','AB "Naujasis Vilnius", _','Nenuteka nuotekos praustuve tualeto patalpoje',,'Konstitucijos pr. 14-vieðbutis, Balkevièienë, 861856865','1.1. Avarinio ekipaþo atvykimas pagal iðkvietimà. Nuotekø tinklo apþiûra . Sifono po praustuvu 1-mo aukðto moterø tualeto patalpoje iðardymas ir iðvalymas. Nuotekos tinklø vamzdþio valymas su gyvatuku  kai vamzdþio skersmuo iki 50 mm., ilgis iki 10 m.  ir sifono remontas po praustuvu tualeto patalpoje. Sifono surinkimas ir fekalijø nutekëjimo patikrinimas vandens srove.','',48.3879
2016-05-31,'16.05.31','13:45','14:00','14:15','Nëra sutarties','Teka vanduo ið vamzdþio bute',,'Versmiø 34-n.n., Danutë, 860660541','1.10. Avarinio ekipaþo atvykimas pagal iðkvietimà. Avarinës situacijos patikrinimas ir avarijos pobûdþio nustatymas. Nustatyta, kad reikalingas trûkusios ðalto vandens ávadinio skaitiklio kojelës keitimas rûsyje. Atvykus ðaltas vanduo buvo jau uþdarytas, dirba UAB "Vilniaus vandenys" darbuotojai.','',15.6937
2016-05-31,'16.05.31','15:00','15:20','16:30','Nëra sutarties','Teka karðtas vanduo ið vamzdþio ðil. mazge',,'Þirmûnø 1h-stovëjimo aikðtelë, Burlëga, 860100046','1.10. Avarinio ekipaþo atvykimas pagal iðkvietimà. Avarinës situacijos patikrinimas ir avarijos pobûdþio nustatymas. Nustatyta, kad trûkæs karðto vandens vamzdis ðil. mazge iki ávadiniø sklendþiø. Karðtà vandená pastatui uþdarë iðkviesta  UAB "Vilniaus energija".','',15.6937
2016-05-31,'16.05.31','15:50','16:25','17:55','UAB ,,Yglë pastatø valdymas" kvieèia tik atsak.asm.','Nenuteka nuotekos ceche.  Uþsikimðæs bendras nuotekø  vamzdis.',,'Virðuliðkiø 30-maxima, Atsak. Vladimiras, 861278611','1.5. Avarinio ekipaþo atvykimas pagal iðkvietimà. Nuotekø tinklo apþiûra. Bendro nuotekos tinklø  vamzdþio valymas su elektrine freza, kai vamzdþio skersmuo iki 100 mm., ilgis daugiau kaip 10 m. ið trapo konditerijos cecho  grindyse.  Fekalijø nutekëjimo patikrinimas vandens srove. Dalyvavo atsakingas asmuo.','',48.3879
2016-05-31,'16.05.31','16:30','16:40','17:20','UAB "Senamiesèio ûkis " (Tel. 2627890), _','Teka vanduo ið vamzdþio bute','Praneðta UAB "Vilniaus vandenys"  Cicënienë','Liejyklos 4-19, Ratnikienë, 860379263','2.2. Avarinio ekipaþo atvykimas pagal iðkvietimà. Situacijos ávertinimas. Raktø prie uþdaromos armatûros priëjimo ir komunikacijø iðdëstymo suradimas. Ðalto vandens tiekimo iðjungimas namui uþdarant ventilá. Vandens iðleidimas ið sistemos atidarius nuleidëjà. Reikalingas trûkusios ðalto vandens alkûnës iki 20 mm.  keitimas prie skaitiklio virtuvëje. Keis savo jëgomis. Nuimta plomba nuo ðalto vandens skaitiklio bute. Sk. Nr. 7437632/96  Pl. Nr. VV209136  Rodm. 03218 Informuota  UAB "Vilniaus vandenys" telefonu 2664371','',21.864699999999997
2016-05-31,'16.05.31','16:30','16:50','17:40','UAB ,,Yglë pastatø valdymas" kvieèia tik atsak.asm.','Kyla nuotekos plautuvëje. Uþsikimðæs bendras nuotekø vamzdis',,'Savanoriø 31-maxima, Atsak. Maèiulis, 869962286','1.3. Avarinio ekipaþo atvykimas pagal iðkvietimà. Nuotekø tinklo apþiûra. Bendro nuotekos tinklø  vamzdþio valymas su gyvatuku, kai vamzdþio skersmuo iki 50 mm., ilgis daugiau kaip 10 m. ið pravalos svërimo skyriuje.  Fekalijø nutekëjimo patikrinimas vandens srove.','',39.7969
2016-05-31,'16.05.31','16:40','18:00','19:00','956-oji DNSB','Teka vanduo ið vamzdþio bute. Trûkusi k.v. lanksti þarnelë virtuvës maiðytuvui',,'Didlaukio 44-74, Ðaluchina, 862045176','2.1Avarinio ekipaþo atvykimas pagal iðkvietimà. Situacijos ávertinimas. Karðto vandens tiekimo iðjungimas butui uþdarant ventilá. Reikalingas trûkusios karðto vandens lanksèios þarnelës keitimas virtuvës maiðytuvui. Nëra priëjimo, reikalingas plautuvës demontavimas.','',18.8155
2016-05-31,'16.05.31','17:30','17:40','17:55','UAB "Ðilëja " (Tel. 2466644), _','Teka vanduo ið virðaus',,'Gelvonø 38-21, Purakaitë, 867115974','1.10. Avarinio ekipaþo atvykimas pagal iðkvietimà. Avarinës situacijos patikrinimas ir avarijos pobûdþio nustatymas. Nustatyta, kad virðutiniame 33-me bute buvo paliktas atsuktas praustuvo èiaupas vonioje ir vanduo tekëjo ant grindø. Atvykimo metu èiaupà uþsuko patys gyv. Uþpiltos 21-mo buto tualeto bei koridoriaus lubos. Gyv. neturëjo pinigø susimokëti.','',15.6937
