'PriemData','pData','Laikas','Pradzia','Pabaiga','Organizacija','avAprasymas','avPranesta','IskvietimoVieta','Darbai','Medziagos','SumaSuPVM'
2017-03-15,'17.03.15','20:25','20:40','21:10','UAB "Fabeta " nuo 16 val. 30 min. iki 7 val. 30 min. d.dien.ir visomis nedarbo bei ðvenèiø dienomis.(dël neaiðk. skambinti energetikui - Edvardas Trinkûnas tel. 867472732','Teka vanduo ið vamzdþio tech. spintoje bute',,'Stanevièiaus S. 11','1.6. Avarinio ekipaþo atvykimas pagal iðkvietimà. Nuotekø  tinklo dalies apþiûra  ir defektø nustatymas. Bendro nuotekos tinklø virtuvinio plastikinio stovo iki 50 mm. sujungimas 69-to buto koridoriaus tech. spintoje.  Sujungimo vietø sandarumo tikrinimas.','',25.821399999999997
2017-03-15,'17.03.15','20:25','21:15','21:45','UAB "Fabeta " nuo 16 val. 30 min. iki 7 val. 30 min. d.dien.ir visomis nedarbo bei ðvenèiø dienomis.(dël neaiðk. skambinti energetikui - Edvardas Trinkûnas tel. 867472732, 2','Kyla  nuotekos  virtuvëje. Uþsikimðæs bendras virtuvinis nuotekø stovas',,'Stanevièiaus S. 11','1.3. Avarinio ekipaþo atvykimas pagal iðkvietimà. Nuotekø tinklo apþiûra. Sifono po plautuve virtuvës patalpoje iðardymas ir iðvalymas.  Nuotekø  tinklø bendro virtuvinio stovo  valymas su gyvatuku tarp 3-èio ir 4-to aukðtø  kai vamzdþio  skersmuo iki 50 mm., ilgis daugiau kaip 10 m.  Sifono surinkimas ir fekalijø nutekëjimo patikrinimas vandens srove.','',33.1661
2017-03-15,'17.03.15','21:55','22:05','23:05','Nëra sutarties','Kyla nuotekos klozete. Uþsikimðæs bendras  nuotekø vamzdis.',,'Þalgirio 135','1.5. Avarinio ekipaþo atvykimas pagal iðkvietimà. Nuotekø tinklo apþiûra. Bendro nuotekos tinklø  vamzdþio valymas su elektrine freza, kai vamzdþio skersmuo iki 100 mm., ilgis daugiau kaip 10 m. ið trapo tualeto patalpos  grindyse.  Fekalijø nutekëjimo patikrinimas vandens srove. (Iðtraukëme daug rankðluostiniø popieriø).','',63.4282
2017-03-15,'17.03.15','22:00','22:15','22:35','Daugiabuèio namo Ðviesos g. Nr. 12 savininkø bendrija , 754/14','Uþpiltos 35-to buto lubos',,'Ðviesos  Grigiðkës 12','1.10. Avarinio ekipaþo atvykimas pagal iðkvietimà. Avarinës situacijos patikrinimas ir avarijos pobûdþio nustatymas. Nustatyta, kad atvykimo metu vanduo jau nebetekëjo. Uþpiltos lubos ir sienos 35-to buto koridoriuje. Virðutiniame 39-me bute paikrinus matomus inþinierinius tinklus vandens pratekëjimo neaptikome. Gyv. nuo vandens uþdarymo atsisakë.','',18.827600000000003
2017-03-15,'17.03.15','22:35','23:00','23:30','UAB "Ðilëja " (Tel. 2466644), _','Teka vanduo ið vamzdþio bute',,'Paberþës 10','1.10. Avarinio ekipaþo atvykimas pagal iðkvietimà. Avarinës situacijos patikrinimas ir avarijos pobûdþio nustatymas. Nustatyta, kad reikalingas trûkusio ðalto vandens filtro korpuso skalbimo maðinai keitimas tualeto patalpoje. Atvykimo metu vanduo buvo jau uþdarytas.','',18.827600000000003
2017-03-15,'17.03.15','23:15','23:30','00:40','UAB "Ðilëja " (Tel. 2466644), _','Kyla nuotekos klozete. Uþsikimðæs bendras  nuotekø stovas.',,'Ukmergës 224','1.2. Avarinio ekipaþo atvykimas pagal iðkvietimà. Nuotekø tinklo apþiûra.  Tech. spintos  iðardymas buto koridoriuje.  Pravalos dangèio nuëmimas  stovui tech. spintoje bute. Nuotekø  tinklø bendro stovo  valymas su gyvatuku tarp 11-to ir  12-to aukðtø kai  skersmuo iki 100 mm., ilgis iki  10 m.    Pravalos dangèio uþdëjimas. Tech. spintos surinkimas  ir fekalijø nutekëjimo patikrinimas vandens srove.','',45.9195
2017-03-15,'17.03.15','07:00','07:15','08:00','UAB "Naujoji Pilaitë" (Tel. 2307414; 865565023) nereaguoti á gyvent.iðkvietim.dël prieðg.sist.), 11','Kyla  nuotekos  virtuvëje. Uþsikimðæs bendras virtuvinis nuotekø stovas',,'Tolminkiemio 23','1.5. Avarinio ekipaþo atvykimas pagal iðkvietimà. Nuotekø tinklo apþiûra . Pravalos dangèio nuëmimas atsukant varþtus stovui rûsyje.  Nuotekos tinklø bendro virtuvinio stovo valymas su elektrine freza   kai vamzdþio  skersmuo iki 100 mm., ilgis daugiau kaip 10 m.  Pravalos dangèio uþdëjimas ir fekalijø nutekëjimo patikrinimas vandens srove.','',40.329299999999994
2017-03-15,'17.03.15','07:00','07:30','08:20','UAB "Ozo miestas", _','Nëra elektros butuose',,'Ukmergës 200','4.2. Avarinio ekipaþo atvykimas pagal iðkvietimà. Elektros instaliacijos  apþiûra.  Srovës  ir átampos parametrø matavimas atskiruose fazëse bei kontaktø patikrinimas. Gedimo pobûdþio ir vietos nustatymas. Elektrà butams davëm laikinai pritvirtindami el.  saugiklio laikiklá namo elektros skydinëje.  El. skydelio atidarymas ir uþdarymas. Reikalingas elektros saugiklio laikiklio keitimas. Namo administratorius informuotas.','',28.5076
2017-03-15,'17.03.15','07:30','07:45','08:30','UAB "Senamiesèio ûkis " (Tel. 2611695, 2627890), _','Kyla nuotekos klozete. Uþsikimðæs bendras  nuotekø stovas.',,'Pylimo 63','1.5. Avarinio ekipaþo atvykimas pagal iðkvietimà. Nuotekø tinklo apþiûra.  Pravalos dangèio nuëmimas  stovui bute.  Nuotekos tinklø bendro stovo  valymas su elektrine  freza kai vamzdþio skersmuo iki 100 mm., ilgis daugiau kaip 10 m.  Pravalos dangèio uþdëjimas ir fekalijø nutekëjimo patikrinimas vandens srove.','',40.329299999999994
2017-03-15,'17.03.15','09:15','09:55','10:20','Nëra sutarties',' Nenuteka nuotekos  rûsyje.  ',,'Pavilnio sodø 3-oji 21','1.10. Avarinio ekipaþo atvykimas pagal iðkvietimà. Ðulinio dangèio nuëmimas ir uþdëjimas. Avarinës situacijos ávertinimas ir avarijos pobûdþio nustatymas. Nustatyta, kad pilnas vietinis nuotekø ðulinys kieme. Reikalingas nuotekø ðulinio asenizavimas.','',15.6937
2017-03-15,'17.03.15','10:10','10:55','11:15','Nëra sutarties','Teka vanduo tualete',,'Þiemos 12','1.10. Avarinio ekipaþo atvykimas pagal iðkvietimà. Avarinës situacijos patikrinimas ir avarijos pobûdþio nustatymas. Nustatyta, kad reikalingas klozeto trûkusio  sujungimo su plastikiniu  triðakiu keitimas tualeto patalpoje su klozeto demontavimu. ','',15.6937
2017-03-15,'17.03.15','10:15','10:30','11:25','Nëra sutarties, _','Kyla nuotekos ið trapo parduotuvës patalpoje. Uþsikimðæs bendras nuotekø  vamzdis.',,'Architektø 17','1.5. Avarinio ekipaþo atvykimas pagal iðkvietimà. Nuotekø tinklo apþiûra. Bendro nuotekos tinklø  vamzdþio valymas su elektrine freza, kai vamzdþio skersmuo iki 100 mm., ilgis daugiau kaip 10 m. ið trapo parduotuvës  grindyse.  Fekalijø nutekëjimo patikrinimas vandens srove.','',48.3879
2017-03-15,'17.03.15','13:05','13:20','13:40','225-oji DNSB  "Juna", _','Teka vanduo ið vamzdþio bute',,'Justiniðkiø 78','1.10. Avarinio ekipaþo atvykimas pagal iðkvietimà. Avarinës situacijos patikrinimas ir avarijos pobûdþio nustatymas. Nustatyta, kad reikalingas sulûþusio sifono po plautuve virtuvës patalpoje keitimas. Iðkvietëjos papraðyta nesinaudoti plautuve kol nepakeis sifono.  Gyv. neturëjo pinigø susimokëti, praðë iðstatyti uþ kitas paslaugas. ','',15.6937
2017-03-15,'17.03.15','13:55','14:20','15:00','Nëra sutarties','Kyla nuotekos klozete. Uþsikimðæs bendras  nuotekø vamzdis',,'Lukðio P. 34','1.10. Avarinio ekipaþo atvykimas pagal iðkvietimà.  Avarinës situacijos ávertinimas ir avarijos pobûdþio nustatymas. Nustatyta, kad  valant  nuotekos tinklø vamzdá su gyvatuku ið klozeto negalime pravalyti, reikalingas klozeto demontavimas arba pravalos árengimas.','',15.6937
2017-03-15,'17.03.15','14:10','14:25','15:00','UAB ,,Vaikystës sodas", 703/14','Kyla nuotekos klozete. Uþsikimðæs bendras  nuotekø vamzdis',,'Antakalnio 28','1.5. Avarinio ekipaþo atvykimas pagal iðkvietimà. Nuotekø tinklo apþiûra. Bendro nuotekos tinklø  vamzdþio valymas su elektrine freza, kai vamzdþio skersmuo iki 100 mm., ilgis daugiau kaip 10 m. ið pravalos ðil. mazgo   grindyse rûsyje.  Fekalijø nutekëjimo patikrinimas vandens srove.','',48.3879
2017-03-15,'17.03.15','14:20','14:40','15:10','Nëra sutarties','Jauèiasi kanalizacijos kvapas patalpoje',,'Labdariø 8','1.10. Avarinio ekipaþo atvykimas pagal iðkvietimà. Avarinës situacijos patikrinimas ir avarijos pobûdþio nustatymas. Nustatyta, kad atvykimo metu kanalizacijos kvapo jautësi nedaug. Patikrinus inþinierinius tinklus nuotekø pratekëjimo neaptikome bei patikrinus klozetà ir praustuvà nuotekos nuteka normaliai.','',18.827600000000003
2017-03-15,'17.03.15','14:40','15:20','16:30','Nëra sutarties','Kyla nuotekos klozete. Uþsikimðæs bendras  nuotekø vamzdis',,'Vytenio 61','1.4. Avarinio ekipaþo atvykimas pagal iðkvietimà. Nuotekø tinklo apþiûra. Bendro nuotekos tinklø  vamzdþio valymas su elektrine freza, kai vamzdþio skersmuo iki 100 mm., ilgis daugiau kaip 10 m. ið pravalos pirties patalpos   prieduobëje.  Fekalijø nutekëjimo patikrinimas vandens srove.','',39.7969
2017-03-15,'17.03.15','15:00','15:20','15:45','Nëra sutarties','Teka vanduo ið vamzdþio bute',,'Marcinkevièiaus M. 24','1.10. Avarinio ekipaþo atvykimas pagal iðkvietimà. Avarinës situacijos patikrinimas ir avarijos pobûdþio nustatymas. Nustatyta, kad reikalingas trûkusios ðalto vandens lanksèios þarnelës keitimas virtuvës maiðytuvui. Atvykimo metu vanduo buvo jau uþdarytas.','',15.6937
2017-03-15,'17.03.15','16:20','16:30','16:55','DNSB "Namas"','Kyla  nuotekos  virtuvëje. Uþsikimðæs bendras virtuvinis nuotekø stovas',,'Konarskio S. 30','1.3. Avarinio ekipaþo atvykimas pagal iðkvietimà. Nuotekø tinklo apþiûra. Pravalos dangèio nuëmimas atsukant varþtus stovui rûsyje. Nuotekø  tinklø bendro virtuvinio stovo  valymas su gyvatuku tarp 1-mo ir 2-tro aukðto kai  skersmuo iki 50 mm., ilgis daugiau kaip 10 m.  Pravalos dangèio uþdëjimas ir fekalijø nutekëjimo patikrinimas vandens srove.','',33.1661
2017-03-15,'17.03.15','16:35','16:50','17:20','Nëra sutarties','Nenuteka nuotekos pisuoruose',,'Gynëjø 14','1.1. Avarinio ekipaþo atvykimas pagal iðkvietimà. Nuotekø tinklo apþiûra. Nuotekos tinklø  vamzdþio valymas su rankine pompa , kai vamzdþio skersmuo iki 100 mm.  per du pisuarus tualeto patalpoje .  Fekalijø nutekëjimo patikrinimas vandens srove.','',54.5952
2017-03-15,'17.03.15','17:25','18:05','19:25','888-oji DNSB, 851/16','Kyla nuotekos klozete. Uþsikimðæs bendras  nuotekø vamzdis.',,'Ðilo 29','1.5. Avarinio ekipaþo atvykimas pagal iðkvietimà. Nuotekø tinklo apþiûra. Ávadinio ðulinio dangèio atidarymas. Nuotekos tinklø  valymas elektrine freza, kai vamzdþio skersmuo iki 100 mm., ilgis daugiau kaip 10 m. ið ðulinio iki pastato  .  Ðulinio dangèio uþdarymas. Fekalijø nutekëjimo patikrinimas vandens srove.','',40.329299999999994
2017-03-15,'17.03.15','17:50','18:05','18:40','UAB Gusto namai','Kyla nuotekos ið trapo virtuvës grindyse. Uþsikimðæs bendras  nuotekø vamzdis',,'Geleþinkelio 16','1.5. Avarinio ekipaþo atvykimas pagal iðkvietimà. Nuotekø tinklo apþiûra. Bendro nuotekos tinklø  vamzdþio valymas su elektrine freza, kai vamzdþio skersmuo iki 100 mm., ilgis daugiau kaip 10 m. ið trapo  virtuvës patalpos  grindyse.  Fekalijø nutekëjimo patikrinimas vandens srove.','',48.3879
2017-03-15,'17.03.15','18:10','18:40','19:10','UAB "Verkiø bûstas " (Tel. 2477330; 862020601), _','Laða vanduo ið virðaus',,'Baltupio 41','1.10. Avarinio ekipaþo atvykimas pagal iðkvietimà. Avarinës situacijos patikrinimas ir avarijos pobûdþio nustatymas. Nustatyta, kad atvykimo metu vanduo jau nebelaðëjo. Virðutiniuose 23-me ir 24-me butuose patikrinus matomus inþinierinius tinklus vandens pratekëjimo neaptikome. Gyv. nuo vandens uþdarymo atsisakë. Drëgnos lubos 18-to buto koridoriuje.','',15.6937
2017-03-15,'17.03.15','18:30','18:55','19:15','UAB "SERVICO" (Tel. 861568173), _','Laða vanduo laiptinëje','Praneðti UAB "SERVICO" ','Mindaugo 27','2.1Avarinio ekipaþo atvykimas pagal iðkvietimà. Situacijos ávertinimas. Ðildymo sistemos  tiekimo iðjungimas 365-am butui uþdarant ventilá buto kolektoriuje. Drëgnos lubos 2-tro aukðto laiptinëje. Patikrinus matomus inþinierinius tinklus 365-me bute pratekëjimo neaptikome.','',18.8155
