'PriemData','pData','Laikas','Pradzia','Pabaiga','Organizacija','avAprasymas','avPranesta','IskvietimoVieta','Darbai','Medziagos','SumaSuPVM'
2017-10-13,'17.10.13','17:20','17:45','18:10','UAB "Fabeta " nuo 16 val. 30 min. iki 7 val. 30 min. d.dien.ir visomis nedarbo bei ðvenèiø dienomis.(dël neaiðk. skambinti energetikui - Gintaras Savickas tel. 867472732, 2','Kyla  nuotekos  virtuvëje. Uþsikimðæs bendras virtuvinis nuotekø stovas',,'S. Neries 47','1.3. Avarinio ekipaþo atvykimas pagal iðkvietimà. Nuotekø tinklo apþiûra. Pravalos dangèio nuëmimas atsukant varþtus stovui rûsyje. Nuotekø  tinklø bendro virtuvinio stovo  valymas su gyvatuku tarp 3-èio ir 2-tro aukðtø kai vamzdþio  skersmuo iki 50 mm., ilgis daugiau kaip 10 m.  Pravalos dangèio uþdëjimas ir fekalijø nutekëjimo patikrinimas vandens srove.','',33.1661
2017-10-13,'17.10.13','17:20','17:55','18:35','UAB "Jurita" - d. d. nuo 7-30 iki 16-30, kont. tel. 2426518, 860613838, , 50/2014','Nenuteka nuotekos  rûsyje.  Uþsikimðæs bendras nuotekø  vamzdis  rûsyje','Praneðta UAB "Vilniaus vandenys"','Taikos 109','1.3. Avarinio ekipaþo atvykimas pagal iðkvietimà. Nuotekø tinklo apþiûra. Bendro nuotekos tinklø  vamzdþio valymas su gyvatuku, kai vamzdþio skersmuo iki 100 mm., ilgis daugiau kaip 10 m. ið pravalos rûsio  grindyse.  Fekalijø nutekëjimo patikrinimas vandens srove. Reikalingas nuotekø ðulinio iðvalymas. Praneðta UAB "Vilniaus vandenys".','',33.1661
2017-10-13,'17.10.13','18:20','18:50','19:10','UAB "Ðilëja " (Tel. 2466644), _','Laða vanduo ið virðaus',,'Èiobiðkio 39','1.10. Avarinio ekipaþo atvykimas pagal iðkvietimà. Avarinës situacijos patikrinimas ir avarijos pobûdþio nustatymas. Nustatyta, kad atvykimo metu vanduo jau nebelaðëjo. Virðutiniame 31-me bute patikrinus matomus inþinierinius tinklus vandens pratekëjimo neaptikome, tech. spinta uþdengta prie vamzdþiø apþiûrai nëra priëjimo. Drëgnos 27-to buto lubos vonioje ir koridoriuje.','',15.6937
2017-10-13,'17.10.13','18:20','18:55','20:00','Nëra sutarties','Kyla nuotekos klozete. Uþsikimðæs bendras  nuotekø vamzdis',,'Islandijos 4','1.5. Avarinio ekipaþo atvykimas pagal iðkvietimà. Nuotekø tinklo apþiûra. Bendro nuotekos tinklø  vamzdþio valymas su elektrine freza, kai vamzdþio skersmuo iki 100 mm., ilgis daugiau kaip 10 m. ið pravalos tualeto patalpos  grindyse rûsyje.  Fekalijø nutekëjimo patikrinimas vandens srove.','',48.3879
2017-10-13,'17.10.13','19:00','19:15','19:40','60-oji DNSB darbo d. iðk.vykd. nuo 20 val.iki 8 val.ir  kvieèia pirm.Gruðenkov tel. 860255900, pavad.Kavaliukas tel.86245770 arba sant.tel.869968141,poils.ir ðven.d.visà parà ir be  skamb.pirmininkui , _','Kyla nuotekos klozete. Uþsikimðæs bendras  nuotekø stovas.',,'Stanevièiaus S. 14','1.5. Avarinio ekipaþo atvykimas pagal iðkvietimà. Nuotekø tinklo apþiûra.  Pravalos dangèio nuëmimas  stovui tech. spintoje bute.  Nuotekos tinklø bendro stovo  valymas su elektrine  freza kai vamzdþio skersmuo iki 100 mm., ilgis daugiau kaip 10 m.  Pravalos dangèio uþdëjimas ir fekalijø nutekëjimo patikrinimas vandens srove.','',40.329299999999994
2017-10-13,'17.10.13','22:15','22:45','23:50','Nëra sutarties','Kyla nuotekos klozete',,'Ligoninës 5','1.10. Avarinio ekipaþo atvykimas pagal iðkvietimà. Avarinës situacijos patikrinimas ir avarijos pobûdþio nustatymas. Nustatyta, kad nuotekø tinklø vamzdþio valant su gyvatuku pravalyti negalime, átaremas vamzdþio lûþis po þeme.','',15.6937
2017-10-13,'17.10.13','00:20','00:45','01:20','UAB "ADMI" (Reaguot tik atsak. asm. iðkvietim.-Rolandas Juðka , Dainius Valèiukas, Oleg Kupreðèenko ir Mykolas Miliauskas: 865056203, 860910287, 865565034 ir 868515930.ir UAB ,,AKTKC". Jeigu skambino gyv.,-turite sakyti tel. 200 11 22, 114/2014','Kibirkðèiuoja el. laidai laiptinëje',,'Kalvarijø 112','4.2. Avarinio ekipaþo atvykimas pagal iðkvietimà. Elektros instaliacijos  apþiûra.  Srovës  ir átampos parametrø matavimas atskiruose fazëse bei kontaktø patikrinimas.  Kontaktø remontas bendrame tinkle 16-to aukðto laiptinës elektros skydelyje.  Ávadinës dëþutës dangèio atidarymas ir uþdarymas prisukant jà varþtais.-','',28.5076
2017-10-13,'17.10.13','01:05','01:20','02:00','UAB "Verkiø bûstas " (Tel. 2477330; 862020601)','Laða vanduo ið virðaus',,'Jeruzalës 27','1.10. Avarinio ekipaþo atvykimas pagal iðkvietimà. Avarinës situacijos patikrinimas ir avarijos pobûdþio nustatymas. Nustatyta, kad laða vanduo ið perdenginio prie lango buto kambaryje. Virðutiniame 407-me bute nieks neatidarë durø. Ðildymo sistemos uþdaryti namui nebuvo galimybës, nëra priëjimo prie ðil. mazgo, nes negalëjome patekti á rûsá. ','',18.827600000000003
2017-10-13,'17.10.13','06:40','07:35','08:30','98-oji DNSB "Þiburëlis", 615/12','Teka vanduo ið vamzdþio rûsyje',,'Tuskulënø 16','2.3. Avarinio ekipaþo atvykimas pagal iðkvietimà. Avarinës situacijos ávertinimas. Prarûdijusios arba trukusios vamzdþio vietos suradimas, daþø ir rûdþiø nuvalymas. Guminës tarpinës uþdëjimas. Spaustuvo árengimas ðalto vandens vamzdþiui iki 32 mm.   uþverþiant  varþtais rûsyje. Taisomos vietos sandarumo patikrinimas.','Metalo apkaba d-32 1 vnt',24.623500000000003
2017-10-13,'17.10.13','07:30','07:50','08:05','UAB "Namø ûkis", 65-102','Nëra elektros butuose',,'Savanoriø 56 (1,2 ir3 korp.)','4.1. Avarinio ekipaþo atvykimas pagal iðkvietimà.  Srovës ir átampos parametrø matavimas atskiruose fazëse bei kontaktø patikrinimas. Nustatyta, kad nëra vienos fazës ið PP  Nr. 2572. Praneðta UAB "ESO".','',15.6937
2017-10-13,'17.10.13','09:15','09:55','10:25','Nëra sutarties','Teka vanduo ið tualeto bakelio',,'Visoriø 6','1.10. Avarinio ekipaþo atvykimas pagal iðkvietimà. Avarinës situacijos patikrinimas ir avarijos pobûdþio nustatymas. Nustatyta, kad  atvykimo metu vanduo nebetekëjo, rekomenduotina nuleidimo mechanizmo keitimas tualeto bakeliui.','',18.827600000000003
2017-10-13,'17.10.13','10:35','10:45','11:35','UAB ,,Yglë pastatø valdymas" kvieèia tik atsak.asm.','Kyla  nuotekos  virtuvëje. Uþsikimðæs bendras  virtuvinis nuotekø vamzdis ',,'Pelesos 35','1.2. Avarinio ekipaþo atvykimas pagal iðkvietimà. Nuotekø tinklo apþiûra. Sifono po plautuve virtuvës patalpoje iðardymas ir iðvalymas.  Nuotekø  tinklø bendro virtuvinio vamzdþio  valymas su gyvatuku  kai vamzdþio  skersmuo iki 50 mm., ilgis iki 10 m.  Sifono surinkimas ir fekalijø nutekëjimo patikrinimas vandens srove.','',38.574799999999994
2017-10-13,'17.10.13','10:50','11:45','12:00','UAB ,,Saterlita", 828/16','Kyla nuotekos moterø klozete',,'Motorø 4','1.10. Avarinio ekipaþo atvykimas pagal iðkvietimà. Avarinës situacijos patikrinimas ir avarijos pobûdþio nustatymas. Nustatyta, kad atvykimo metu patikrinus kelis kartus nuleidþiant vandená, nuotekos moterø klozete nuteka normaliai.','',18.827600000000003
2017-10-13,'17.10.13','11:30','12:00','12:45','Vieðoji ástaiga N.Vilnios poliklinika','Kyla nuotekos klozete. Uþsikimðæs   nuotekø  vamzdis iki stovo.',,'Sirokomlës 8','1.1. Avarinio ekipaþo atvykimas pagal iðkvietimà. Nuotekø tinklo apþiûra . Nuotekø  tinklø vamzdþio valymas  su gyvatuku  kai vamzdþio skersmuo iki 100 mm., ilgis iki 5 m. ið pravalos 4-to aukðto moterø  tualeto patalpoje.   Fekalijø nutekëjimo patikrinimas vandens srove.','',32.742599999999994
2017-10-13,'17.10.13','11:50','12:20','13:00','Nëra sutarties','Ûþia radiatoriai patalpoje',,'Ðvarco 1','1.10. Avarinio ekipaþo atvykimas pagal iðkvietimà. Avarinës situacijos patikrinimas ir avarijos pobûdþio nustatymas. Nustatyta, kad atvykimo metu radiatoriai patalpoje nebe ûþia.','',18.827600000000003
2017-10-13,'17.10.13','12:30','13:05','13:50','Nëra sutarties','Kyla nuotekos klozete. Uþsikimðæs bendras  nuotekø vamzdis.',,'Poðkos D. 39','1.5. Avarinio ekipaþo atvykimas pagal iðkvietimà. Nuotekø tinklo apþiûra.  Pravalos dangèio nuëmimas  stovui rûsyje.  Nuotekos tinklø bendro vamzdþio  valymas su elektrine  freza kai vamzdþio skersmuo iki 100 mm., ilgis daugiau kaip 10 m.  Pravalos dangèio uþdëjimas ir fekalijø nutekëjimo patikrinimas vandens srove.','',48.3879
2017-10-13,'17.10.13','14:25','14:35','15:00','UAB ,,Ovantis", 717/14','Kyla nuotekos klozete. Uþsikimðæs bendras  nuotekø stovas.',,'Laisvës  pr. 5','1.5. Avarinio ekipaþo atvykimas pagal iðkvietimà. Nuotekø tinklo apþiûra.  Pravalos dangèio nuëmimas  stovui 1-mo aukðto moterø tualeto patalpoje.  Nuotekos tinklø bendro stovo  valymas su elektrine  freza kai vamzdþio skersmuo iki 100 mm., ilgis daugiau kaip 10 m.  Pravalos dangèio uþdëjimas ir fekalijø nutekëjimo patikrinimas vandens srove.','',48.3879
2017-10-13,'17.10.13','15:40','16:00','17:15','Nëra sutarties','Kyla nuotekos klozete. Uþsikimðæs bendras  nuotekø stovas.',,'Slucko 7','1.5. Avarinio ekipaþo atvykimas pagal iðkvietimà. Nuotekø tinklo apþiûra.  Pravalos dangèio nuëmimas atsukant varþtus stovui rûsyje.  Nuotekos tinklø bendro stovo  valymas su elektrine  freza kai vamzdþio skersmuo iki 100 mm., ilgis daugiau kaip 10 m.  Pravalos dangèio uþdëjimas ir fekalijø nutekëjimo patikrinimas vandens srove.','',40.329299999999994
2017-10-13,'17.10.13','16:05','16:20','17:20','Nëra sutarties','Kyla nuotekos klozete. Uþsikimðæs bendras  nuotekø vamzdis',,'Pamënkalnio 13','1.5. Avarinio ekipaþo atvykimas pagal iðkvietimà. Nuotekø tinklo apþiûra.  Pravalos dangèio nuëmimas vamzdþiui restorano patalpoje.  Nuotekos tinklø bendro vamzdþio  valymas su elektrine  freza kai vamzdþio skersmuo iki 100 mm., ilgis daugiau kaip 10 m.  Pravalos dangèio uþdëjimas ir fekalijø nutekëjimo patikrinimas vandens srove.','',48.3879
2017-10-13,'17.10.13','16:30','17:25','17:55','Nëra sutarties','Kyla  nuotekos  virtuvëje. Uþsikimðæs bendras virtuvinis nuotekø vamzdis',,'Tilto 2a','1.5. Avarinio ekipaþo atvykimas pagal iðkvietimà. Nuotekø tinklo apþiûra. Bendro nuotekos tinklø  vamzdþio valymas su elektrine freza, kai vamzdþio skersmuo iki 100 mm., ilgis daugiau kaip 10 m. ið pravalos virtuvës patalpos  grindyse.  Fekalijø nutekëjimo patikrinimas vandens srove.','',48.3879
2017-10-13,'17.10.13','16:50','17:05','17:35','UAB "Fabeta " nuo 16 val. 30 min. iki 7 val. 30 min. d.dien.ir visomis nedarbo bei ðvenèiø dienomis.(dël neaiðk. skambinti energetikui - Gintaras Savickas tel. 867472732, 2',' Nenuteka nuotekos  rûsyje.  Uþsikimðæs bendras nuotekø  vamzdis  rûsyje',,'L. Giros 82','1.5. Avarinio ekipaþo atvykimas pagal iðkvietimà. Nuotekø tinklo apþiûra. Bendro nuotekos tinklø  vamzdþio valymas su elektrine freza, kai vamzdþio skersmuo iki 100 mm., ilgis daugiau kaip 10 m. ið pravalos rûsio  grindyse.  Fekalijø nutekëjimo patikrinimas vandens srove.','',40.329299999999994
2017-10-13,'17.10.13','17:00','17:30','18:10','UAB "Pastatø meistrai"- gavus praneðimà -ne vëliai kaip per dvi val. atvykti.Kont. asm.Tomas Kiðunas 862048707, Tomas Pupkus 865597556, Kiek.v. ryta atask.-klauskite@civinity.euinform.gyvent.-tel. 870055188, 17/MA-150','Kyla nuotekos klozete. Uþsikimðæs bendras  nuotekø stovas.',,'Pylimo 63','1.5. Avarinio ekipaþo atvykimas pagal iðkvietimà. Nuotekø tinklo apþiûra.  Pravalos dangèio nuëmimas  stovui tech. spintoje bute.  Nuotekos tinklø bendro vamzdþio  valymas su elektrine  freza kai vamzdþio skersmuo iki 100 mm., ilgis daugiau kaip 10 m.  Pravalos dangèio uþdëjimas ir fekalijø nutekëjimo patikrinimas vandens srove.','',40.329299999999994
